# LeetCode Problem of The Day <img src="https://github.com/user-attachments/assets/2be88086-3bd9-47b8-b796-5d497169772a" width="40">

This repository contains solutions to problems from ***[LeetCode](https://leetcode.com/problemset/)***. The files are named using the **problem number** for easy identification and organization.

## Key Features
- **Solutions Only**: This repository focuses on providing direct solutions without explanations.
- **File Naming**: Files are named using the problem number, e.g., `1313.java` for Problem 1313. And the **Topic** is mentioned in the **commit message**
- **Multiple Languages**: Solutions are primarily in **Java**, with potential use of other languages.

## Daily Progress Log - LeetCode

| Date       | Problem Number | Language | Solution Link                         | Problem Link                          |
|------------|----------------|----------|---------------------------------------|---------------------------------------|
| 02-03-2025 | 2570 | Java | [Solution](./2570.java) | [Problem](https://leetcode.com/problems/merge-two-2d-arrays-by-summing-values/description/?envType=daily-question&envId=2025-03-02) |
| 01-03-2025 | 2460 | Java | [Solution](./2460.java) | [Problem](https://leetcode.com/problems/apply-operations-to-an-array/description/?envType=daily-question&envId=2025-03-01) |
| 28-02-2025 | 1092 | Java | [Solution](./1092.java) | [Problem](https://leetcode.com/problems/shortest-common-supersequence/description/?envType=daily-question&envId=2025-02-28) |
| 27-02-2025 | 873  | Java | [Solution](./873.java)  | [Problem](https://leetcode.com/problems/length-of-longest-fibonacci-subsequence/description/?envType=daily-question&envId=2025-02-27) |
| 26-02-2025 | 1749 | Java | [Solution](./1749.java) | [Problem](https://leetcode.com/problems/maximum-absolute-sum-of-any-subarray/description/?envType=daily-question&envId=2025-02-26) |
| 25-02-2025 | 1524 | Java | [Solution](./1524.java) | [Problem](https://leetcode.com/problems/number-of-sub-arrays-with-odd-sum/?envType=daily-question&envId=2025-02-25) |
| 24-02-2025 | 2467 | Java | [Solution](./2467.java) | [Problem](https://leetcode.com/problems/most-profitable-path-in-a-tree/description/?envType=daily-question&envId=2025-02-24) |
| 23-02-2025 | 889  | Java | [Solution](./889.java)  | [Problem](https://leetcode.com/problems/construct-binary-tree-from-preorder-and-postorder-traversal/description/?envType=daily-question&envId=2025-02-23) |
| 22-02-2025 | 1028 | Java | [Solution](./1028.java) | [Problem](https://leetcode.com/problems/recover-a-tree-from-preorder-traversal/description/?envType=daily-question&envId=2025-02-22) |
| 21-02-2025 | 1261 | Java | [Solution](./1261.java) | [Problem](https://leetcode.com/problems/find-elements-in-a-contaminated-binary-tree/description/?envType=daily-question&envId=2025-02-21) |
| 20-02-2025 | 1980 | Java | [Solution](./1980.java) | [Problem](https://leetcode.com/problems/find-unique-binary-string/description/?envType=daily-question&envId=2025-02-20) |
| 19-02-2025 | 1415 | Java | [Solution](./1415.java) | [Problem](https://leetcode.com/problems/the-k-th-lexicographical-string-of-all-happy-strings-of-length-n/description/?envType=daily-question&envId=2025-02-19) |
| 18-02-2025 | 2375 | Java | [Solution](./2375.java) | [Problem](https://leetcode.com/problems/construct-smallest-number-from-di-string/description/?envType=daily-question&envId=2025-02-18) |
| 17-02-2025 | 1079 | Java | [Solution](./1079.java) | [Problem](https://leetcode.com/problems/letter-tile-possibilities/description/?envType=daily-question&envId=2025-02-17) |
| 16-02-2025 | 1718 | Java | [Solution](./1718.java) | [Problem](https://leetcode.com/problems/construct-the-lexicographically-largest-valid-sequence/description/?envType=daily-question&envId=2025-02-16) |
| 15-02-2025 | 2698 | Java | [Solution](./2698.java) | [Problem](https://leetcode.com/problems/find-the-punishment-number-of-an-integer/description/?envType=daily-question&envId=2025-02-15) |
| 14-02-2025 | 1352 | Java | [Solution](./1352.java) | [Problem](https://leetcode.com/problems/product-of-the-last-k-numbers/description/?envType=daily-question&envId=2025-02-14) |
| 13-02-2025 | 3066 | Java | [Solution](./3066.java) | [Problem](https://leetcode.com/problems/minimum-operations-to-exceed-threshold-value-ii/description/?envType=daily-question&envId=2025-02-13) |
| 12-02-2025 | 2342 | Java | [Solution](./2342.java) | [Problem](https://leetcode.com/problems/max-sum-of-a-pair-with-equal-sum-of-digits/description/?envType=daily-question&envId=2025-02-12) |
| 11-02-2025 | 1910 | Java | [Solution](./1910.java) | [Problem](https://leetcode.com/problems/remove-all-occurrences-of-a-substring/description/?envType=daily-question&envId=2025-02-11) |
| 10-02-2025 | 3174 | Java | [Solution](./3174.java) | [Problem](https://leetcode.com/problems/clear-digits/description/?envType=daily-question&envId=2025-02-10) |
| 09-02-2025 | 2364 | Java | [Solution](./2364.java) | [Problem](https://leetcode.com/problems/count-number-of-bad-pairs/description/?envType=daily-question&envId=2025-02-09) |
| 08-02-2025 | 2349 | Java | [Solution](./2349.java) | [Problem](https://leetcode.com/problems/design-a-number-container-system/description/?envType=daily-question&envId=2025-02-08) |
| 07-02-2025 | 3160 | Java | [Solution](./3160.java) | [Problem](https://leetcode.com/problems/find-the-number-of-distinct-colors-among-the-balls/description/?envType=daily-question&envId=2025-02-07) |
| 06-02-2025 | 1726 | Java | [Solution](./1726.java) | [Problem](https://leetcode.com/problems/tuple-with-same-product/description/?envType=daily-question&envId=2025-02-06) |
| 05-02-2025 | 1790 | Java | [Solution](./1790.java) | [Problem](https://leetcode.com/problems/check-if-one-string-swap-can-make-strings-equal/description/?envType=daily-question&envId=2025-02-05) |
| 04-02-2025 | 1800 | Java | [Solution](./1800.java) | [Problem](https://leetcode.com/problems/maximum-ascending-subarray-sum/description/?envType=daily-question&envId=2025-02-04) |
| 03-02-2025 | 3105 | Java | [Solution](./3105.java) | [Problem](https://leetcode.com/problems/longest-strictly-increasing-or-strictly-decreasing-subarray/description/?envType=daily-question&envId=2025-02-03) |
| 02-02-2025 | 1752 | Java | [Solution](./1752.java) | [Problem](https://leetcode.com/problems/check-if-array-is-sorted-and-rotated/description/?envType=daily-question&envId=2025-02-02) |
| 01-02-2025 | 3151 | Java | [Solution](./3151.java) | [Problem](https://leetcode.com/problems/special-array-i/description/?envType=daily-question&envId=2025-02-01) |
| 31-01-2025 | 827  | Java | [Solution](./827.java)  | [Problem](https://leetcode.com/problems/making-a-large-island/description/?envType=daily-question&envId=2025-01-31) |
| 30-01-2025 | 2493 | Java | [Solution](./2493.java) | [Problem](https://leetcode.com/problems/divide-nodes-into-the-maximum-number-of-groups/description/?envType=daily-question&envId=2025-01-30) |
| 28-01-2025 | 2658 | Java | [Solution](./2658.java) | [Problem](https://leetcode.com/problems/maximum-number-of-fish-in-a-grid/?envType=daily-question&envId=2025-01-28) |
| 27-01-2025 | 1462 | Java | [Solution](./1462.java) | [Problem](https://leetcode.com/problems/course-schedule-iv/description/?envType=daily-question&envId=2025-01-27) |
| 26-01-2025 | 2127 | Java | [Solution](./2127.java) | [Problem](https://leetcode.com/problems/maximum-employees-to-be-invited-to-a-meeting/description/?envType=daily-question&envId=2025-01-26) |
| 25-01-2025 | 2948 | Java | [Solution](./2948.java) | [Problem](https://leetcode.com/problems/make-lexicographically-smallest-array-by-swapping-elements/description/?envType=daily-question&envId=2025-01-25) |
| 24-01-2025 | 802  | Java | [Solution](./802.java)  | [problem](https://leetcode.com/problems/find-eventual-safe-states/description/?envType=daily-question&envId=2025-01-24) |
| 23-01-2025 | 1267 | Java | [Solution](./1267.java) | [problem](https://leetcode.com/problems/count-servers-that-communicate/description/?envType=daily-question&envId=2025-01-23) |
| 22-01-2025 | 1765 | Java | [Solution](./1765.java) | [problem](https://leetcode.com/problems/map-of-highest-peak/?envType=daily-question&envId=2025-01-22) |
| 21-01-2025 | 2017 | Java | [Solution](./2017.java) | [problem](https://leetcode.com/problems/grid-game/description/?envType=daily-question&envId=2025-01-21) |
| 20-01-2025 | 2661 | Java | [Solution](./2661.java) | [problem](https://leetcode.com/problems/first-completely-painted-row-or-column/description/?envType=daily-question&envId=2025-01-20) |
| 19-01-2025 | 407  | Java | [Solution](./407.java)  | [problem](https://leetcode.com/problems/trapping-rain-water-ii/description/?envType=daily-question&envId=2025-01-19) |
| 18-01-2025 | 1368 | Java | [Solution](./1368.java) | [problem](https://leetcode.com/problems/minimum-cost-to-make-at-least-one-valid-path-in-a-grid/description/?envType=daily-question&envId=2025-01-18) |
| 17-01-2025 | 2683 | Java | [Solution](./2683.java) | [problem](https://leetcode.com/problems/neighboring-bitwise-xor/description/?envType=daily-question&envId=2025-01-17) |
| 16-01-2025 | 2425 | Java | [Solution](./2425.java) | [problem](https://leetcode.com/problems/bitwise-xor-of-all-pairings/description/?envType=daily-question&envId=2025-01-16) |
| 15-01-2025 | 2429 | Java | [Solution](./2429.java) | [problem](https://leetcode.com/problems/minimize-xor/description/?envType=daily-question&envId=2025-01-15) |
| 14-01-2025 | 2657 | Java | [Solution](./2657.java) | [problem](https://leetcode.com/problems/find-the-prefix-common-array-of-two-arrays/description/?envType=daily-question&envId=2025-01-14) |
| 13-01-2025 | 3223 | Java | [Solution](./3223.java) | [problem](https://leetcode.com/problems/minimum-length-of-string-after-operations/description/?envType=daily-question&envId=2025-01-13) |
| 12-01-2025 | 2116 | Java | [Solution](./2116.java) | [problem](https://leetcode.com/problems/check-if-a-parentheses-string-can-be-valid/description/?envType=daily-question&envId=2025-01-12) |
| 11-01-2025 | 1400 | Java | [Solution](./1400.java) | [problem](https://leetcode.com/problems/construct-k-palindrome-strings/description/?envType=daily-question&envId=2025-01-11) |
| 10-01-2025 | 916  | Java | [Solution](./916.java)  | [problem](https://leetcode.com/problems/word-subsets/description/?envType=daily-question&envId=2025-01-10) |
| 09-01-2025 | 2185 | Java | [Solution](./2185.java) | [problem](https://leetcode.com/problems/counting-words-with-a-given-prefix/description/?envType=daily-question&envId=2025-01-09) |
| 08-01-2025 | 3042 | Java | [Solution](./3042.java) | [problem](https://leetcode.com/problems/count-prefix-and-suffix-pairs-i/description/?envType=daily-question&envId=2025-01-08) |
| 07-01-2025 | 1408 | Java | [Solution](./1408.java) | [problem](https://leetcode.com/problems/string-matching-in-an-array/description/?envType=daily-question&envId=2025-01-07) |
| 06-01-2025 | 1769 | Java | [Solution](./1769.java) | [problem](https://leetcode.com/problems/minimum-number-of-operations-to-move-all-balls-to-each-box/description/?envType=daily-question&envId=2025-01-06) |
| 05-01-2025 | 2381 | Java | [Solution](./2381.java) | [problem](https://leetcode.com/problems/shifting-letters-ii/description/?envType=daily-question&envId=2025-01-05) |
| 04-01-2025 | 1930 | Java | [Solution](./1930.java) | [problem](https://leetcode.com/problems/unique-length-3-palindromic-subsequences/description/?envType=daily-question&envId=2025-01-04) |
| 03-01-2025 | 2270 | Java | [Solution](./2270.java) | [problem](https://leetcode.com/problems/number-of-ways-to-split-array/description/?envType=daily-question&envId=2025-01-03) |
| 02-01-2025 | 2559 | Java | [Solution](./2559.java) | [problem](https://leetcode.com/problems/count-vowel-strings-in-ranges/description/?envType=daily-question&envId=2025-01-02) |
| 01-01-2025 | 1422 | Java | [Solution](./1422.java) | [problem](https://leetcode.com/problems/maximum-score-after-splitting-a-string/description/?envType=daily-question&envId=2025-01-01) |

(to be updated as new topics are added)

## Contributing
If you'd like to contribute to this repository, feel free to submit a pull request with new topics or improvements to existing code.

To add new solutions:

1. Fork the repository.
2. Add your solutions using the problem number as the filename.
3. Submit a pull request.

## License
This repository is licensed under the <a href="https://github.com/Jomon-J/LeetCode-POTD/blob/main/LICENSE">MIT License</a>.

## 🌟 *Don’t Forget to Star!*
If you find this repo useful, please consider giving it a star ⭐. It helps others discover it too!
